{
  "channel_name": "Unclaimed",
  "channel_id": "TODO-separate-google-account",
  "central_question": "Is money being held, withheld, overlooked or left unclaimed?",
  "role_in_network": "Commercial engine",
  "audience": "US adults 25-65. Homeowners, employees, parents, consumers, travellers, accident victims, former tenants, people managing estates, people dealing with insurance or medical bills.",
  "format": {
    "person": "second person",
    "length_minutes": "8-12",
    "word_count": "1300-1900",
    "tone": "Calm, credible, practical. No 'free money' language. Every episode ends with a verification step."
  },
  "episode_structure": [
    { "beat": "The overlooked money", "purpose": "State the opportunity plainly." },
    { "beat": "Why the money exists", "purpose": "The programme, obligation, settlement, policy or legal mechanism." },
    { "beat": "Who may qualify", "purpose": "Eligibility branches shown visually." },
    { "beat": "Where people lose it", "purpose": "Missed deadlines, missing documents, wrong assumptions, scams, incomplete submissions." },
    { "beat": "How to verify it", "purpose": "Official databases, notices, administrators, documentation. Named on screen, never in the description alone." },
    { "beat": "What to prepare", "purpose": "A simple document checklist." },
    { "beat": "Sign-off", "purpose": "Locked closing line." }
  ],
  "sign_off": "The money may be unclaimed. It does not have to stay that way.",
  "visual_style": {
    "style_contract": "ISO",
    "style_string": "Soft matte low-poly isometric 3D illustration, clean thirty degree isometric projection, pale sage green background, objects modelled in warm bone cream and pale putty with soft long diffuse shadows, cornflower periwinkle blue used for hands handles and human elements, one saturated emerald green accent used only to mark money that is recoverable, simple faceless rounded figures at consistent small scale, matte non-reflective surfaces, soft even ambient light with no harsh highlights, generous negative space around the subject, subtle film grain, no photorealism, no gloss, no textures, 16:9",
    "ground": "White or light paper, subtle fibre texture",
    "linework": "Black marker, slightly imperfect",
    "accent": "Green or gold, single accent",
    "accent_rule": "Green marks money that is recoverable. Grey marks money that is gone. Never decorative.",
    "frame_vocabulary": ["claim forms", "letters", "payment trails", "timelines", "document stacks", "portal screens", "eligibility trees", "money moving between institutions"],
    "must_not_look_like": ["a crypto channel", "a get-rich-quick channel", "a law firm advert", "a government presentation", "a personal finance slideshow"],
    "frames_per_episode": "100-140",
    "motion": "Elements draw on in sequence. Arrows travel along the money trail. The highlighted amount lands last in each frame. No camera moves beyond a slow drift. Real portals are screen-recorded, never illustrated."
  },
  "voice": {
    "provider": "elevenlabs",
    "voice_id": "SAz9YHcvj6GT2YYXdXww",
    "voice_id_status": "confirmed on Episode 1",
    "voice_name": "River - Relaxed, Neutral, Informative",
    "engine": "elevenlabs_rest",
    "model_id": "eleven_multilingual_v2",
    "character": "Warm, measured"
  },
  "thumbnails": {
    "template_id": "TODO-canva-template-unclaimed",
    "word_cap": 4,
    "formula": "One object plus one number or one eligibility trigger.",
    "example_phrases": ["They Still Owe You", "Check Your Name", "You May Qualify", "Refund Never Sent", "Where It Went", "Before It Expires"]
  },
  "playlists": ["Forgotten Money", "Refunds", "Settlements", "Insurance", "Work and Government"],
  "disclaimer_block": "This video is general information, not legal, tax or financial advice. Eligibility, amounts and deadlines vary and change; nothing here guarantees a payment or outcome. Always verify through the official sources named in the video before acting. Links below go to official databases and administrators only.",
  "shorts": {
    "per_episode": 3,
    "source_beat": "How to verify it (the 'how to check' beat)"
  },
  "gates": {
    "fact_check_human_signoff": true,
    "legal_review_required": false,
    "source_url_required": true
  },
  "cadence": {
    "long_form_per_week": "2-3",
    "shorts_per_week": "6-9"
  },
  "rpm_estimate_usd": "RPM $10-22, CPM $22-45. Higher on insurance, tax, banking, legal compensation; lower on general refunds.",
  "music": "Envato, one locked track family. Minimal, no build-and-drop. TODO: lock track family."
}
